event_id,event_title,event_date,ticker,market_index,readiness_status,notes
E019,Huawei Added to U.S. Entity List,2019-05-15,2330.TW,^TWII,Blocked - market data backfill required,"Current local processed market data starts in 2022; backfill 2018-2019 TSMC/TWSE data before CAR calculation. Optional NVDA/SOX/NASDAQ coverage may be useful."
E020,Huawei Foreign-Direct-Product Rule,2020-05-15,2330.TW,^TWII,Blocked - market data backfill and confounding review required,"Requires 2019-2020 market backfill. Shares event date with E022, so attribution risk must be documented."
E021,SMIC Added to U.S. Entity List,2020-12-18,2330.TW,^TWII,Blocked - market data backfill required,"Requires 2020 market backfill before CAR calculation. Consider optional SOX/NASDAQ comparator for semiconductor-policy exposure."
E022,TSMC Announces $12B Arizona Fab,2020-05-15,2330.TW,^TWII,Blocked - market data backfill and confounding review required,"Requires 2019-2020 market backfill. Shares event date with Huawei FDP rule, so event-window interpretation needs caution."
E023,CHIPS and Science Act Signed,2022-08-09,2330.TW,^TWII,Integrated in V3 CAR output,"Integrated into results/event_abnormal_return_summary_v3.csv using the validated event date and existing benchmark-adjusted CAR workflow."
E024,AI Chip Export Control Expansion,2023-10-17,2330.TW,^TWII,Integrated in V3 CAR output,"Integrated into results/event_abnormal_return_summary_v3.csv using the validated event date and existing benchmark-adjusted CAR workflow."
E025,China Big Fund III Established,2024-05-24,2330.TW,^TWII,Integrated with date caveat,"Integrated using the validated 2024-05-24 registration date. Public-disclosure timing around 2024-05-27 remains a sensitivity issue for interpretation."
